{"schema_version":"private-recruiter-conversion-outcome-v1","artifact_kind":"private_recruiter_conversion_outcome","locale":"en","event_date":"2026-08-08","event_type":"stop_decision","source_artifact_id":"D-106","source_version":"draft-v1","fact_ids":["F-107"],"observation_state":"observed_candidate_reported","next_safe_action":"record_stop_decision","delivery":{"draft_only":true,"external_actions_authorized":false,"no_message_action":true,"no_calendar_action":true,"raw_event_retained":false,"local_save_mode":"disabled"}}
